{
  "schema_version": "0.1.0",
  "run_id": "20000000-0000-4000-8000-000000000013",
  "drawing_id": "10000000-0000-4000-8000-000000000013",
  "drawing_hash": "sha256:8384bbee43d1d82fddc63ad65c8a508183d958752327c39ff7197e6078dca863",
  "mode": "draft",
  "profile_versions": {
    "generic": "0.1.0",
    "gb-eng-residential": "0.1.0"
  },
  "results": [
    {
      "id": "result-1",
      "rule_id": "generic-steel_beam_bearing-geometry",
      "profile": {
        "id": "generic",
        "version": "0.1.0"
      },
      "category": "geometry",
      "status": "flag",
      "reason": "unverified",
      "object_ids": [
        "wall"
      ],
      "message": "Examiner geometry rule requires professional verification.",
      "document": null,
      "rule_state": "unverified",
      "signer": null,
      "auto_fix": {
        "available": false
      },
      "resolution": null
    },
    {
      "id": "result-2",
      "rule_id": "gb-eng-residential-steel_beam_bearing-continuity",
      "profile": {
        "id": "gb-eng-residential",
        "version": "0.1.0"
      },
      "category": "thermal",
      "status": "flag",
      "reason": "unverified",
      "object_ids": [
        "wall"
      ],
      "message": "Examiner detail continuity rule requires professional verification.",
      "document": null,
      "rule_state": "unverified",
      "signer": null,
      "auto_fix": {
        "available": false
      },
      "resolution": null
    }
  ],
  "checks_not_performed": [
    {
      "category": "structural",
      "label": "structural"
    },
    {
      "category": "fire_stopping",
      "label": "fire stopping"
    },
    {
      "category": "acoustic",
      "label": "acoustic"
    }
  ],
  "blocked": [],
  "summary": {
    "performed": 2,
    "passed": 0,
    "flagged": 2,
    "out_of_scope": 0
  },
  "generated_at": "2026-09-27T00:00:00Z"
}
